{
  "id": "UCBcRF18a7Qf58cCRy5xuWwQ",
  "title": "TRAVIS",
  "description": "Relaxing virtual train rides through beautiful scenery. Calm, slow, and deliberate content for focused viewing.",
  "customUrl": "@TRAVIS",
  "thumbnailUrl": "https://yt3.googleusercontent.com/example-travis-thumbnail",
  "subscriberCount": 250000,
  "videoCount": 120,
  "source": "youtube",
  "updatedAt": "2026-03-20T10:00:00Z",
  "tags": ["trains", "relaxation", "scenery"]
}
